{
  "error_symmetry": 1.0000,
  "latency_symmetry": 0.7375,
  "throughput_confidence": 1.0000,
  "composite_score": 0.7950,
  "interpretation": "fairly_comparable",
  "computed_at": "2026-07-24T09:26:23Z",
  "targets": [
    "entity-read-by-id-20260724-091931-000000",
    "entity-read-by-id-20260724-091931-000000"
  ],
  "asymmetry_notes": []
}
